{
  "schema": "comfy.runtime-requirements/1",
  "id": "inside-valdivia-h3-control-experimental",
  "required_endpoints": ["features", "system_stats", "object_info", "queue"],
  "required_node_types": [
    "BasicGuider", "BasicScheduler", "CLIPLoader", "CauceAcceptDecodedRange",
    "CauceH3AddAVSpanGuide", "CauceH3ApplyVideoDenoiseMask", "CauceH3AllocateAVWindow",
    "CauceH3AppendAVSpan", "CauceH3ClearAVDenoiseMask", "CauceH3DilateVisualTokens",
    "CauceH3ExpandAVCanvas", "CauceH3ExtractAVSpan", "CauceH3ExtractVisualStream",
    "CauceH3InspectAVLatent", "CauceH3InspectConditioning", "CauceH3InspectPackedSequence",
    "CauceH3PlaceAVSpan", "CauceH3PlanAVWindow", "CauceH3PlanControlClip",
    "CauceH3PrepareGuideClip", "CauceH3PrepareReferenceClip", "CauceH3ReplaceAVSpan",
    "CauceH3ReplaceVisualStream", "CauceH3ResizeAVLatent", "CauceH3ResolveTargetShape",
    "CauceH3SetAVDenoiseInterval", "CauceH3SplitAVLatent", "CauceLoadAVLatent",
    "CaucePlanH3GuideRetime", "CauceRestoreDecodedAnchors", "CauceSaveAVLatent",
    "CreateVideo", "GetVideoComponents", "ImageBatch", "KSamplerSelect", "LoadImage",
    "LoadVideo", "MiniMaxH3AddGuide", "MiniMaxH3FunControlNetApply",
    "MiniMaxH3ImageToVideo", "MiniMaxH3ReferenceToVideo", "ModelPatchLoader",
    "RandomNoise", "SamplerCustomAdvanced", "SaveVideo", "UNETLoader", "VAEDecode", "VAELoader"
  ],
  "node_type_groups": [],
  "required_models": [
    "minimax_h3_fun_controlnet_union_pruned_int8_convrot.safetensors",
    "minimax_h3_audio_vae_fp32.safetensors",
    "minimax_h3_fl2va_pruned_int8_convrot.safetensors",
    "minimax_h3_ref2va_pruned_int8_convrot.safetensors",
    "minimax_h3_video_vae_fp16.safetensors",
    "qwen3vl_32b_minimax_h3_nvfp4_awq.safetensors"
  ],
  "hardware": {
    "minimum_total_ram_bytes": 60000000000,
    "minimum_total_vram_bytes": 30000000000,
    "device_name_contains": "5090"
  },
  "require_queue_idle": true,
  "manual_checks": [
    "Confirm at least 30 GB free before staging another heavyweight model; the selected pruned INT8 control patch is 2,296,635,360 bytes.",
    "Require the live ModelPatchLoader and MiniMaxH3FunControlNetApply schemas before sampling.",
    "Start at native pixel bounds, inspect packed rows, and record peak VRAM/RAM before increasing duration or geometry.",
    "Treat reference+control and decoded masked inpaint as separate characterization graphs until each receives an independent visual verdict."
  ]
}
